{
  "page": 1,
  "pageSize": 66,
  "totalItems": 66,
  "totalPages": 1,
  "filters": {
    "day": null,
    "venueId": null,
    "performerId": null
  },
  "items": [
    {
      "id": "e1",
      "day": "2026-07-10",
      "theme": "Rock Day",
      "start": "12:00",
      "end": "12:40",
      "performerId": "p26",
      "venueId": "v2",
      "performer": {
        "id": "p26",
        "name": "SPŠ Rockers",
        "type": "music",
        "genre": "rock"
      },
      "venue": {
        "id": "v2",
        "name": "Aréna na kopečku",
        "description": "Druhá největší scéna festivalu určená pro malé kapely, taneční vystoupení a soutěže.",
        "capacity": 3500
      }
    },
    {
      "id": "e2",
      "day": "2026-07-10",
      "theme": "Rock Day",
      "start": "13:00",
      "end": "13:40",
      "performerId": "p27",
      "venueId": "v2",
      "performer": {
        "id": "p27",
        "name": "Gympl Band Praha",
        "type": "music",
        "genre": "rock"
      },
      "venue": {
        "id": "v2",
        "name": "Aréna na kopečku",
        "description": "Druhá největší scéna festivalu určená pro malé kapely, taneční vystoupení a soutěže.",
        "capacity": 3500
      }
    },
    {
      "id": "e3",
      "day": "2026-07-10",
      "theme": "Rock Day",
      "start": "14:00",
      "end": "15:00",
      "performerId": "p1",
      "venueId": "v1",
      "performer": {
        "id": "p1",
        "name": "Kabát",
        "type": "music",
        "genre": "rock"
      },
      "venue": {
        "id": "v1",
        "name": "Hlavní Stage",
        "description": "Největší festivalová scéna umístěná na vrcholu kopce s panoramatickým výhledem na ČVUT.",
        "capacity": 5000
      }
    },
    {
      "id": "e4",
      "day": "2026-07-10",
      "theme": "Rock Day",
      "start": "15:00",
      "end": "15:20",
      "performerId": "p56",
      "venueId": "v2",
      "performer": {
        "id": "p56",
        "name": "Dance Crew Praha",
        "type": "dance"
      },
      "venue": {
        "id": "v2",
        "name": "Aréna na kopečku",
        "description": "Druhá největší scéna festivalu určená pro malé kapely, taneční vystoupení a soutěže.",
        "capacity": 3500
      }
    },
    {
      "id": "e5",
      "day": "2026-07-10",
      "theme": "Rock Day",
      "start": "15:30",
      "end": "16:30",
      "performerId": "p2",
      "venueId": "v1",
      "performer": {
        "id": "p2",
        "name": "Divokej Bill",
        "type": "music",
        "genre": "rock"
      },
      "venue": {
        "id": "v1",
        "name": "Hlavní Stage",
        "description": "Největší festivalová scéna umístěná na vrcholu kopce s panoramatickým výhledem na ČVUT.",
        "capacity": 5000
      }
    },
    {
      "id": "e6",
      "day": "2026-07-10",
      "theme": "Rock Day",
      "start": "17:00",
      "end": "18:00",
      "performerId": "p3",
      "venueId": "v1",
      "performer": {
        "id": "p3",
        "name": "Doga",
        "type": "music",
        "genre": "rock"
      },
      "venue": {
        "id": "v1",
        "name": "Hlavní Stage",
        "description": "Největší festivalová scéna umístěná na vrcholu kopce s panoramatickým výhledem na ČVUT.",
        "capacity": 5000
      }
    },
    {
      "id": "e7",
      "day": "2026-07-10",
      "theme": "Rock Day",
      "start": "17:00",
      "end": "17:30",
      "performerId": "p60",
      "venueId": "v2",
      "performer": {
        "id": "p60",
        "name": "Air Guitar Championship",
        "type": "competition"
      },
      "venue": {
        "id": "v2",
        "name": "Aréna na kopečku",
        "description": "Druhá největší scéna festivalu určená pro malé kapely, taneční vystoupení a soutěže.",
        "capacity": 3500
      }
    },
    {
      "id": "e8",
      "day": "2026-07-10",
      "theme": "Rock Day",
      "start": "18:30",
      "end": "19:30",
      "performerId": "p4",
      "venueId": "v1",
      "performer": {
        "id": "p4",
        "name": "Harlej",
        "type": "music",
        "genre": "rock"
      },
      "venue": {
        "id": "v1",
        "name": "Hlavní Stage",
        "description": "Největší festivalová scéna umístěná na vrcholu kopce s panoramatickým výhledem na ČVUT.",
        "capacity": 5000
      }
    },
    {
      "id": "e9",
      "day": "2026-07-10",
      "theme": "Rock Day",
      "start": "20:00",
      "end": "21:00",
      "performerId": "p5",
      "venueId": "v1",
      "performer": {
        "id": "p5",
        "name": "Škwor",
        "type": "music",
        "genre": "rock"
      },
      "venue": {
        "id": "v1",
        "name": "Hlavní Stage",
        "description": "Největší festivalová scéna umístěná na vrcholu kopce s panoramatickým výhledem na ČVUT.",
        "capacity": 5000
      }
    },
    {
      "id": "e10",
      "day": "2026-07-10",
      "theme": "Rock Day",
      "start": "21:30",
      "end": "22:30",
      "performerId": "p6",
      "venueId": "v1",
      "performer": {
        "id": "p6",
        "name": "Wohnout",
        "type": "music",
        "genre": "rock"
      },
      "venue": {
        "id": "v1",
        "name": "Hlavní Stage",
        "description": "Největší festivalová scéna umístěná na vrcholu kopce s panoramatickým výhledem na ČVUT.",
        "capacity": 5000
      }
    },
    {
      "id": "e11",
      "day": "2026-07-10",
      "theme": "Rock Day",
      "start": "23:00",
      "end": "00:00",
      "performerId": "p7",
      "venueId": "v1",
      "performer": {
        "id": "p7",
        "name": "Arakain",
        "type": "music",
        "genre": "metal"
      },
      "venue": {
        "id": "v1",
        "name": "Hlavní Stage",
        "description": "Největší festivalová scéna umístěná na vrcholu kopce s panoramatickým výhledem na ČVUT.",
        "capacity": 5000
      }
    },
    {
      "id": "e12",
      "day": "2026-07-10",
      "theme": "Rock Day",
      "start": "00:15",
      "end": "01:15",
      "performerId": "p12",
      "venueId": "v1",
      "performer": {
        "id": "p12",
        "name": "Tři sestry",
        "type": "music",
        "genre": "punk"
      },
      "venue": {
        "id": "v1",
        "name": "Hlavní Stage",
        "description": "Největší festivalová scéna umístěná na vrcholu kopce s panoramatickým výhledem na ČVUT.",
        "capacity": 5000
      }
    },
    {
      "id": "e13",
      "day": "2026-07-10",
      "theme": "Rock Day",
      "start": "20:00",
      "end": "20:30",
      "performerId": "p71",
      "venueId": "v2",
      "performer": {
        "id": "p71",
        "name": "Rock Quiz Show",
        "type": "competition"
      },
      "venue": {
        "id": "v2",
        "name": "Aréna na kopečku",
        "description": "Druhá největší scéna festivalu určená pro malé kapely, taneční vystoupení a soutěže.",
        "capacity": 3500
      }
    },
    {
      "id": "e14",
      "day": "2026-07-10",
      "theme": "Rock Day",
      "start": "16:00",
      "end": "16:40",
      "performerId": "p28",
      "venueId": "v2",
      "performer": {
        "id": "p28",
        "name": "SOŠ Beat Crew",
        "type": "music",
        "genre": "pop"
      },
      "venue": {
        "id": "v2",
        "name": "Aréna na kopečku",
        "description": "Druhá největší scéna festivalu určená pro malé kapely, taneční vystoupení a soutěže.",
        "capacity": 3500
      }
    },
    {
      "id": "e15",
      "day": "2026-07-10",
      "theme": "Rock Day",
      "start": "18:00",
      "end": "18:40",
      "performerId": "p29",
      "venueId": "v2",
      "performer": {
        "id": "p29",
        "name": "Technik Sound",
        "type": "music",
        "genre": "rock"
      },
      "venue": {
        "id": "v2",
        "name": "Aréna na kopečku",
        "description": "Druhá největší scéna festivalu určená pro malé kapely, taneční vystoupení a soutěže.",
        "capacity": 3500
      }
    },
    {
      "id": "e16",
      "day": "2026-07-10",
      "theme": "Rock Day",
      "start": "19:00",
      "end": "19:40",
      "performerId": "p30",
      "venueId": "v2",
      "performer": {
        "id": "p30",
        "name": "Učiliště Revival",
        "type": "music",
        "genre": "rock"
      },
      "venue": {
        "id": "v2",
        "name": "Aréna na kopečku",
        "description": "Druhá největší scéna festivalu určená pro malé kapely, taneční vystoupení a soutěže.",
        "capacity": 3500
      }
    },
    {
      "id": "e17",
      "day": "2026-07-10",
      "theme": "Rock Day",
      "start": "21:00",
      "end": "21:40",
      "performerId": "p31",
      "venueId": "v2",
      "performer": {
        "id": "p31",
        "name": "Student Noise",
        "type": "music",
        "genre": "alternative"
      },
      "venue": {
        "id": "v2",
        "name": "Aréna na kopečku",
        "description": "Druhá největší scéna festivalu určená pro malé kapely, taneční vystoupení a soutěže.",
        "capacity": 3500
      }
    },
    {
      "id": "e18",
      "day": "2026-07-10",
      "theme": "Rock Day",
      "start": "22:00",
      "end": "22:40",
      "performerId": "p32",
      "venueId": "v2",
      "performer": {
        "id": "p32",
        "name": "Mladá Vlna",
        "type": "music",
        "genre": "rock"
      },
      "venue": {
        "id": "v2",
        "name": "Aréna na kopečku",
        "description": "Druhá největší scéna festivalu určená pro malé kapely, taneční vystoupení a soutěže.",
        "capacity": 3500
      }
    },
    {
      "id": "e19",
      "day": "2026-07-10",
      "theme": "Rock Day",
      "start": "23:00",
      "end": "23:40",
      "performerId": "p33",
      "venueId": "v2",
      "performer": {
        "id": "p33",
        "name": "Garage Band Brno",
        "type": "music",
        "genre": "rock"
      },
      "venue": {
        "id": "v2",